Scene Number,Instruction Type,Instruction
152.0,,switch to the right lane
152.0,s,continue straight change lanes to avoid parked buses 
152.0,s,slide into the right lane in order to avoid hitting parked busses
152.0,s,Move to the right lane to avoid the bus
154.0,,Finish the left turn
154.0,sd,Take a left turn and merge onto the street. Shift slightly to the right to avoid the yellow car
154.0,d,"complete the turn then slow down for the parkinmg car, continue slowly. Slide slightly to the left to avoid hitting the approaching car"
154.0,d,follow the road move away from approaching vehicle in the same lane 
154.0,,Squeeze to the leftmost side of the road to allow the vehicle in front to squeeze through the middle.
154.0,d,"turn left, slow down for incoming traffic"
155.0,ds,"Make a left turn, but stop at the cross walk when the individual crosses, then proceed after."
155.0,,"turn left here, continue and turn into the left turn lane"
155.0,sd,Take a left turn and then take another left turn on the next left.
155.0,d,"turn left, turn left and come to a stop for incoming pedestrians"
155.0,s,"after turing into the left lane continue along the road, then turn left in the turning lane, but first stop at the crossing and let the pedestrian cross"
157.0,d,turn right when no vehicle is approaching 
157.0,d,"wait until traffic is clear, turn right"
157.0,d,"After the motorcycle drives by from the left side, make a right turn."
157.0,s,"wait at the intersection, then turn right and continue in the left lane."
157.0,s,Wait for the motorcycle to pass before taking a right turn
158.0,d,Wait for the worker to remove the cone before continuing straight and then follow the truck in front
158.0,d,"wait for pedestrians, once clear continue straight"
158.0,d,"Once the path is clear, go straight."
158.0,d,Follow the vehicle ahead
158.0,sd,wait until worker moves away obstructing cone and follow the bus ahead
158.0,d,"wait for the construction worker to remove the traffic cone and then waive the flag, once given the signal to move, proceed slowly."
159.0,d,"wait for pedestrians, once clear continue straight. "
159.0,d,Wait for the workers to pass before continue down the street and then merging onto the lane
159.0,d,"Once all individuals cross the crosswalk, proceed forward."
159.0,d,"wait for the pedestrians to cross, then slowly merge into left lanne of the main street"
159.0,d,wait for all pedestrians to cross the road then continue 
160.0,d,"wait for incoming traffic, once clear continue straight"
160.0,d,"In order to merge into  the road, beign entering the street and then check on coming traffic once it is clear, merge into the street."
160.0,d,Wait for the blue car to pass before moving to the right lane
160.0,sd,drive around parked traffic in the left lane however only change lanes when there are no vehicles approaching from the other side of the road
160.0,ds,"Once all vehicles on the right lane pass by, cross the double-lined road to the right side."
161.0,d,"wait for the Jeep to pass, then slowly move forward"
161.0,d,wait until there is no incoming vehicle from the left side
161.0,d,Wait for the black car to pass before going down the road
161.0,d,"Once the dark-colored vehicle has passed you, proceed forward."
162.0,d,"turn left, wait for incoming traffic once clear turn right. "
162.0,s,Turn left and then turn right
162.0,d,"turn right, then turn right agai to merge into the street."
162.0,d,Make a right turn if no cars are coming from the left side.
162.0,sd,exit the parking lot and turn right 
162.0,s,Make a left turn and stop right before the intersection.
163.0,,turn right at the intersection continue straight 
163.0,,go straight
164.0,s,Take right turn and then go straight
164.0,,turn right. 
164.0,s,turn right and continue on the road
164.0,s,Make the first right turn.
165.0,s,slow down in the construction zone then continue moving straight along the road
166.0,s,keep going straight and begin slowing down as we approach the stop sign.
167.0,,continue following the road 
168.0,,continue going along the road.
170.0,s,Stop right next to the truck.
170.0,,Make a left turn
170.0,s,turn left and stop by the yellow semi truck
170.0,s,Take left turn and then merge onto the lane and stop right before the yellow truck
170.0,s,"turn left at the intersection, then stop near the parked Semi-truck"
170.0,s,turn left and avoid vehicile
171.0,s,Go left when the left lane opens up.
171.0,,continue straight 
171.0,s,"continue on road, avoid hitting parked vehicles"
171.0,s,Continue down the road and move a little bit to the left to avoid the parked trucks
172.0,s,Stop right before the bus and then turn at the incoming left
172.0,s,"go around vehicle , turn left"
172.0,s,"slow down ans stop for the stopped bus, once its safe to go, continue going straight and then make a left turn."
172.0,s,drive around the blue parked bus and turn left at the end of the road 
172.0,s,"Stop right before the blue bus, then after a brief moment continue driving."
172.0,s,Take a left
173.0,s,turn left at the stop sign
173.0,ds,Stop briefly right before the intersection and turn left when there are no cars coming from either side.
173.0,s,Turn left at the dead end
173.0,s,keep going straight and slow down as you enter the intersection.
174.0,,turn left
174.0,s,Turn left and then continue going straight
174.0,s,turn left and then continue going straight.
175.0,s,stop at the intersectio and start moving when it is safe.
175.0,ds,Stop at the stopsign. Take a right when the second vehicle from the left passes.
175.0,s,Go towards the dead end and then stop
176.0,ds,"stop at the intersection near the stop sight, let the black truck pass,then turn right."
176.0,s,turn right at the stop sign when there are also no incoming vehicles
176.0,ds,Stop at the stopsign. Take a right when the vehicle from the left passes.
176.0,s,Stop at the stop sign and then turn right
177.0,ds,"Slowly approach the gate until it opens, then proceed forward."
177.0,s,Stop before you reach the toll gate.
177.0,d,Stop at the gate and then continue once the gate opens
177.0,d,"stop at the gate, move slowly when the arm rises up."
178.0,,follow the road to the right at the fork in the road
178.0,s,Keep going straight and then take right down hill
178.0,,"continue driving on the road, stay on the right side."
178.0,s,Make the second right turn and stay on the left lane.
178.0,,turn right
179.0,ds,"Drive slowly forward until the individual in front passes by, then go straight."
179.0,d,"when the pedestrian passes, continue moving ahead."
179.0,sd,Merge onto the the street after the pedestrian passes
179.0,d,slowly move around walking pedestrian
180.0,s,turn right and then follow the arros on the street.
180.0,,turn right
180.0,,Make a right turn in the parking lot and then follow the path.
181.0,s,Wait for the gate to open and then continue straight
181.0,s,"wait for the gate to open, then proceed slowly"
181.0,d,"Slowly proceed forward until the toll gate opens, then proceed with normal speed."
182.0,,go straight
183.0,,go straight
184.0,,continue along the road
184.0,,continue driving up the hill
185.0,d,take a right here and wait for the pedestrian to cross the road before continuing straight 
185.0,d,"turn right and wait for the pedestrian to cross, once he crosses start moving forward"
185.0,d,Turn right and wait for the pedestrians to pass before continuing straight
185.0,ds,Make a right turn and stop before the crosswalk to let the pedestrian cross the road. Then proceed once the individual has passed.
185.0,d,turn right and wait for pedestrian to pass by
187.0,s,stop at the intersection 
187.0,ds,"Slightly move to the right side of the lane to avoid hitting the person, and stop right before the stopsign."
187.0,d,slow down for pedestrian
188.0,d,ignore pedestrians on the side of the road
188.0,s,continue following the road 
190.0,s,Go straight and then stop behind the grey car
190.0,s,stop behind the stopped car
190.0,ds,Stop right behind the vehicle in front of you.
191.0,,turn right continue straight 
191.0,s,Turn right and then continue going down the road
191.0,s,Turn right when you reach the yellow marking on the road.
191.0,s,turn right at the T junction
192.0,d,Make a left turn when all vehicles from the right pass.
192.0,d,wait till the road is clear of moving cars and turn left
192.0,sd,Wait for the cars to pass and then turn left and merge onto the road
192.0,d,turn left when there are no vehicles approaching
192.0,d,turn left when it is safe to do so.
193.0,s,stop at the intersection
193.0,ds,Stop before the intersection if the stoplight is red.
194.0,s,"follow the road, then stop at the intersection"
194.0,d,follow the silver car ahead 
194.0,d,Follow the vehicle in front of you and take the same turn.
194.0,d,Stop behind the gray car at the stoplight
195.0,d,Pick up to normal speed once passing by the bus and the vehicle that are on the right lane.
195.0,,continue straight on the road
196.0,,go straight
199.0,,go straight
200.0,s,swerve around the container
200.0,s,go around road obstruction
200.0,s,Move slightly to the left of the gray container and then continue driving
200.0,s,continue straight turn slightly right into the right lane drive around the parked truck
200.0,s,"Right before approaching the parked vehicle in front of you, switch to the left lane to avoid hitting it."
202.0,s,Stop at the stopsign. After a full stop proceed through the intersection.
202.0,s,"turn right, stop at the stop sign, then continue driving"
202.0,s,stay on the right lane when ap[racing the stop sign
203.0,d,turn right wait for incoming pedestrian
203.0,sd,Drive to the left and wait for the pedestrian to pass before continuing to drive
203.0,ds,"stop at the zebra crossing wait for the pedestrian to cross, then continue driving"
203.0,d,"turn right here, wait for pedestrian to cross the road and continue straight"
203.0,d,Stop right before the crosswalk to let the individual pass through. Then proceed forward as normal.
204.0,,go straight
206.0,s,"slow down at the intersection, do a slight left turn."
206.0,s,Slow down before turning to the left
207.0,s,Stop right before the crosswalk.
207.0,d,Slow down before approaching the vehicle in front of you and proceed as normal once the vehical makes its turn.
207.0,d,follow the white truck ahead 
207.0,d,"slow down when approaching the turning truck, once it turns come to gradual stop"
208.0,d,"wait for all the cars on the left side to pass, then continue driving."
208.0,d,Wait for the cars to merge onto the street before going straight
208.0,ds,Cross the crosswalk once all cars have merged onto the road
208.0,d,wait  until there are no approaching cars and pedestrians
209.0,,follow the road
209.0,s,stay in the right lane of the road
210.0,s,Slow down and move little to the left to avoid the other trucks and then turn left
210.0,,Drive around the vehicle slightly on your lane and take a left at the end of the road.
210.0,s,"slow down near the intersection, once you cross the intersection turn left."
210.0,,turn left
210.0,s,continue straight drive around any obstructing vehicles and turn left at the end of the road
211.0,s,Turn left  and then stop for a little bit before heading down the road
211.0,s,complete the turn then continue going straight
212.0,d,"slow down, and let the truck pass, then continue going straight"
212.0,d,Slow down for a little bit to avoid the truck and then continue driving down the road
212.0,d,Slow down and move to the right to avoid the front car hitting you when the vehicle in front of you starts to enter your lane from the left side.
213.0,s,slow down and stop at the intersection
213.0,,Stop right before the intersection.
218.0,d,wait for pedestrians
218.0,d,Do not move as long as there are individuals in front of you.
219.0,d,Stay stopped before the intersection if there are cars approaching from the left and right sides of the road.
220.0,ds,Slow down before the crosswalk to allow the individuals to cross the street.
220.0,ds,Slow down right before the intersection to allow the white vehicle fully make its turn. Then proceed as normal.
220.0,s,slow down and stop at the intersection
221.0,ds,Make the left turn once the group of individuals have crossed the crosswalk.
221.0,ds,At the intersection turn left when the pedestrians have finished crossing
221.0,d,turn left and wait for pedestrians
221.0,sd,Slow down and wait for the people to cross before turning left
222.0,d,Proceed forward if the traffic controller on the road gestures to move forward.
224.0,ds,Stop before the intersection to let all individuals cross the road. Stay stopped due to the red light at the intersection.
224.0,s,stop at the intersection
225.0,ds,Make a right turn once the stoplight turns green.
225.0,,turn right
225.0,sd,Stop at the stoplight and wait for the people to cross before turning right
227.0,s,stop at the intersection
228.0,ds,"Slow down and stop before the intersection if the stoplight is red, but proceed with normal speed once it turns green."
230.0,s,Slow down and move to the left a little to avoid the construction zone 
230.0,s,Switch to the left lane to avoid the constriction on the right lane.
230.0,s,slow down and move into the left lane to avoid hitting the traffic cones
230.0,s,go around road obstruction
230.0,ds,Slow down before approaching the crosswalk to allow all individuals to cross the street.
231.0,ds,stop in front of the zebra crossing and let all the pedestrians cross
231.0,ds,Stay stopped before the crosswalk as along as individuals cross it.
231.0,d,wait for walking pedestrians
234.0,d,turn right after the truck passes
234.0,ds,"Once the stoplight has turned green and once the truck has passed through the intersection, make a right turn. Complete the right turn even if there are individuals starting to cross the street."
234.0,s,Stop at the crosswalk and then turn right and continue going straight
234.0,,turn right
235.0,s,stop behind the stopped truck
236.0,d,Follow the truck in front of you while maintaining a safe distance.
237.0,s,"turn left to avoid hitting the parked truck, then stop at the intersection"
237.0,s,Move a little to the left to avoid the truck and then stop at the stoplight
237.0,ds,"Move to the left lane because the right lane is blocked by two cars, and stop right before the intersection if the stoplight is red."
238.0,s,Stop at the curb on the right side of the road right before the crosswalk.
238.0,s,pull up beside the curb
238.0,s,Slow down and move towards the curb on the right and then stop
238.0,,stop beside the curb
239.0,s,Stay stopped on the curb that is right before the crosswalk.
240.0,d,enter the left lane after all the vehicles pass
240.0,ds,"Once all individuals cross the crosswalk and once all vehicles from behind have passed, safely go back onto the road onto the leftmost lane."
240.0,,merge back into the road
240.0,s,Merge to the left lan and then continue straight
242.0,ds,Stay stopped before the intersection if the stoplight is red.
243.0,s,stop behind the stopped car
243.0,d,Slow down and stop right before approaching the vehicle in front.
244.0,d,Slow down and stop right before approaching the vehicle in front.
244.0,s,stop behind the stopped car
246.0,s,Merge to the left lane to avoid the stopped card and then continue straight
246.0,s,Switch to the left lane to avoid the parked vehicle on the right lane.
246.0,s,swtich to the left lane to avoid hitting parked car
247.0,s,switch to the right lane 
247.0,s,"After passing the intersection, switch to the right lane."
247.0,s,Keep going straight and the move to the right lane
248.0,ds,Stay stopped before the intersection if the stoplight is red.
249.0,s,Turn to the right and then continue going straight down the lane
249.0,ds,"Complete the right turn once all individuals have crossed the road, then proceed through the street but slowly come to a stop when you near the vehicle in front of you."
249.0,s,"right right, go straight and slow down near the intersection"
250.0,s,turn right then go straight
250.0,d,Wait for the pedestrians to cross and then turn to the right and the keep going straight
250.0,,turn right
250.0,ds,Complete the rtight turn once the crosswalk is clear and go straight.
251.0,d,Maintain a safe distance with the car in front of you
252.0,d,Come to a slow stop when approaching the vehicle in front of you
252.0,s,stop behind the stopped car
253.0,d,Proceed through traffic with a safe distance from the vehicle in front of you
253.0,d,"low down behind the stopped car, and start moving when the car starts driving"
254.0,s,slow down at the intersection
255.0,s,"stop at the intersection, then turn left"
255.0,,turn left
255.0,sd,Stop at the cross walk and then turn to the left after the gray car merges
255.0,ds,Make a full stop right before the intersection and turn left if there are no cars approaching from the left or right side.
256.0,ds,Switch to the rightmost lane and keep a safe distance behind the vehicles in that lane.
256.0,d,Take a slight right to avoid the trucks and stop behind the smaller truck
256.0,d,enter the right lane and stop behind the small truck
256.0,,switch lanes all the way to the right
257.0,s,Stay stopped as long as the vehicle in front of you is stopped.
258.0,s,Slightly go on the left edge of the lane to avoid hitting the construction that is partially on the right side.
259.0,,turn right
259.0,d,"Make a right turn once the bus has completed its turn in the intersection, and keep a safe distance from the vehicle since it has emergancy lights on."
259.0,ds,turn right at the intersection and slow down behind the bus
259.0,sd,turn right and the slow down behind the bus
260.0,ds,Stay stopped before the intersection if the stoplight is red.
262.0,d,wait for incoming pedestrians. turn right
262.0,sd,Turn right after the pedestrians pass
262.0,d,Make a right turn if there are no individuals crossing the street and if no cars are coming from the left side of the road.
262.0,d,once the pedestrian crosses turn right
263.0,d,"Slow down when the vehicle in front of you starts to turn, but proceed to normal speed once the vehicle is out of your lane."
268.0,s,Shift to the right lane
268.0,s,enter the right turning lane
268.0,ds,"Change to the right lane when it appears, and make a right turn while keeping a safe distance with the vehicle in front."
269.0,s,Turn left and then continue down the road
269.0,,Make a left turn and go straight.
269.0,s,turn left at the intersection and continue going on the road
270.0,s,stop at the intersection 
270.0,ds,"Make a full stop before entering the intersection. Once all cars from the left and right side have crossed the road and once the individual ahead crosses the street, proceed forward."
271.0,ds,"Before approaching the next stopped vehicle ahead, stop to let the vehicle approaching you pass by."
271.0,s,go around stationary vehicle and come to a complete stop
271.0,s,"Move around the vehicle in front by slightly going on the right lane, then switch back to the left lane."
271.0,s,Pass the stopped car and then stop
271.0,s,"swerve around the stopped car, then come to a stop behind the orange car"
272.0,s,"continue going straight, then turn left at the turn"
272.0,d,"Once the vehicle on the right lane has passed you, proceed to move forward"
272.0,s,Continue down the road and then take a left
272.0,,Make a left turn and go straight.
272.0,,turn left
273.0,s,"Briefly switch to the right lane to avoid the parked car in front, then switch back to the left lane."
273.0,s,swerve around the parked car
273.0,s,Shift to the right lane and then back to left lane and then back to the right lane
274.0,d,"Slow down when you see the individual crossing the road, but go to normal speed after."
275.0,s,"go straight, stop at the intersection"
275.0,s,Stop at the stoplight
276.0,d,When the stoplight is green go straight.
276.0,s,"After crossing the intersection, switch to the right lane."
277.0,s,Continue down the road and then take a right
278.0,,Make a right turn.
278.0,ds,"slow down to avoid hitting the scooter, then turn right at the intersection"
278.0,,turn right
278.0,ds,Slow down when passing by the motorcycle near the lane.
283.0,,Make a right turn and go straight.
283.0,,turn right
283.0,s,"turn right at the intersection, then stop at the next intersection"
283.0,s,Take a right and then stop at the stop sign
284.0,d,Make a left turn when the traffic controller gestures his arm to the left side and then go straight.
284.0,,turn left
284.0,s,turn left and then go straight
284.0,s,Take a left at the stop sign and then continue going down road
285.0,ds,"After almost crossing the intersection, slightly move to the left side of the road to avoid the individual walking toward the vehicle. Go to the right lane after"
286.0,s,Make a right turn into the middle lane and go straight.
286.0,s,"turn right, then go straight"
286.0,,turn right
286.0,s,Take a right and then continue down the road
287.0,s,Go straight but stop when before entering the intersection when you see the red stoplight.
288.0,s,stop at the intersection
292.0,s,Switch to the left lane to avoid the obstruction on the road.
292.0,s,slide into the left lane to avoid hitting the parked vehicle
292.0,s,Shift to the left lane to avoid the stopped vehicles and then continue down the road
292.0,,go around road obstruction
293.0,s,lide to the right lane to avoid hitting the parked car
293.0,s,Shift to the right lane and then continue down the road
293.0,d,"After passing the mail truck, switch to the right lane."
293.0,s,Switch to the right lane again after passing all of the construction on the right side.
294.0,s,Stop at the intersection
294.0,s,stop at the intersection
296.0,s,turn right ar the intersection when it is safe
296.0,,turn right
296.0,d,Make a right turn when the stoplight turns green.
296.0,s,Take a right turn
297.0,d,wait for walking pedestrians
297.0,d,"wait for the pedestrians to cross, then turn right"
297.0,d,Wait for the pedestrians to pass and then continue down the road
297.0,ds,"Stop before the crosswalk to allow individuals to cross the road, then continue one they have passed."
298.0,s,Make a right turn at the intersection.
298.0,s,turn right at the intersection
298.0,s,Turn right and then continue down the road
298.0,,turn right
300.0,s,Shift to the left lane
300.0,s,Switch to the left lane when it appears.
301.0,s,stop at the intersection
303.0,s,stop at the intersection behind the truck
305.0,,Change to the right lane.
305.0,s,slide into the right lane
305.0,sd,Shift to the right lane and then left the truck pass behind and then continue down the road
317.0,s,swerve around the parked vehicle
317.0,s,Go around the vehicle in front of you by briefly switching to the right lane and then back to the left lane.
317.0,s,go around road obstruction
317.0,ds,"Make the second left turn, but only cross once all pedestrians have crossed the crosswalk."
317.0,d,Shift to the right to let the blue bus pass and then take a right turn
318.0,ds,"After the vehicle from the right side has passed, briefly switch to the right lane to avoid the parked bus on the left lane."
318.0,s,swerve around the parked vehicle
318.0,d,Shift to the right to let the yellow bus pass and then continue
318.0,s,go around road obstruction
321.0,s,"when the light turns green, go straight"
324.0,s,"slow down to avoid hitting the car in front, then continue driving"
328.0,s,Take a right turn and then take another right
328.0,s,turn right go straight then turn right again at the intersection
328.0,,Make another right turn
328.0,,Make a right turn
328.0,,"turn right, turn right"
329.0,s,"urn left and enter the road, continue driving straight onthe road."
329.0,s,Briefly move to the left side of the road to go around the parked vehicle in front of you.
329.0,s,go around road obstruction
330.0,s,"turn right, go straight then pull over to the side of the road and come to a stop"
330.0,s,Turn to the left and then stop at the curb
330.0,,stop beside the curb
330.0,s,Make a left turn and stop at the curb in front of the building on the right.
331.0,d,Pass the intersection once all cars have passed by
331.0,s,Take a left turn and then continue down the road
331.0,d,turn right at the intersection once all the vehicles have passed and it is safe to turn
332.0,d,Wait for the pedestrians to pass and then continue down the road
332.0,d,"once all the pedestrains pass, drive straight ahead"
332.0,ds,Move forward once the individuals have crossed the crosswalk
332.0,d,wait for pedestrians 
345.0,s,turn right and then go straight
345.0,,turn right
345.0,s,Take a left turn and then continue down the road
345.0,ds,Make a right turn when the stoplight turns green and continue down the road
346.0,s,when the signal turns green continue going straight
347.0,s,stop at the intersection and go when the light turns green
347.0,s,"Briefly switch to the right lane to avoid the cars in front of you, then switch back to the original lane."
347.0,sd,Shift to the left lane and then stop at the stoplight then continue when the lights turn green
348.0,,turn right
348.0,s,turn right and then slide to the left lane then turn left at the intersection
348.0,s,Turn to the right and then shift to the left lane and then take a left turn slowly
348.0,,Make a right turn
348.0,s,Switch to the left lane and make the first left turn
349.0,s,go around road obstruction
349.0,s,Shift to the opposing lane to avoid the white car and then move back to the left lane
349.0,s,swerve around the parked car and continue going straight
349.0,ds,"Once the vehicle in front of you has passed, briefly move to the right lane, and move back to the left lane once you have passed the parked car."
350.0,s,Take a left turn
350.0,s,turn left at the T-junction
350.0,s,Make the first left turn possible
350.0,,turn left
351.0,,turn left
351.0,s,Make a left turn after the stopsign.
