Scene Number,Instruction Type,Instruction
1.0,sd,"turn left into the road, Drive around road blockages"
1.0,d,"Turn left, then stay on the right side to avoid hitting the person on the right side of the truck. Go back to left lane once obstructions on left lane are gone."
1.0,s,Turn right and move to the other lane carefully to avoid the trucks on the side of the road. Move back to other lane when the trucks clear up.
1.0,s,turn right and then slide into the left lane to avoid hitting the trucks
2.0,s,turn left at the intersection
2.0,s,Turn right and continue down this road. The road will change from two lanes into one lane.
2.0,s,"Turn left, then slow down right before the speed bump to reduce impact."
2.0,s,turn left
3.0,d,"Wait unitl the gate opens, move forward, slow down for pedestrians, stop for incoming traffic"
3.0,ds,"Slow down on the speed bump, come to a stop near the toll gate until it opens, slowly proceed but watch out for the group of individuals crossing the street, then turn left"
3.0,sd,"Go straight, but make sure to stop for the crossing bar. Continue forward and watch out for the group of people crossing the road."
3.0,ds,follow the car in front stop for the barricades
4.0,d,"Slightly slow down for the person crossing the street, then preceed as normal."
4.0,,Continue going straight.
4.0,d,be catious of pedestrians
5.0,s,"Switch to the left lane to avoid the construction on the right lane, and preceed on the right lane after the construction is clear."
5.0,s,stop at the intersection
5.0,s,Follow the cones to merge onto the other lane
5.0,sd,Turn and merge onto the left lane. Follow the yellow car in front.
6.0,s,"Switch to the right lane when you see the truck on the left lane, then go back to the left lane once the truck is gone, then turn left"
6.0,ds,Slightly go to the right to avoid hitting the person walking down the left lane
6.0,d,"Continue straight then change lanes when the car is in the way, then turn left immediately."
6.0,s,swerve around the parked car then turn left
6.0,s,"Slow down for road obstruction, Move to the right lane, Move back to left lane and make a left turn. "
7.0,s,Continue straight and then turn left. Watch out for pedestrians on the road.
7.0,d,"Slow down when the people are crossing the street on the left side, then proceed normally."
7.0,,turn left
7.0,,turn left
7.0,d,Turn left after the two individuals cross the street
8.0,,turn left
8.0,,Continue straight and then turn left.
8.0,s,Take the left that comes right after the white truck on the right side of the road.
8.0,,turn left
9.0,,Continue going straight.
10.0,s,Switch to the left lane after passing the final obstructing car parked on the left lane.
10.0,,switch to the left lane
10.0,s,"complete the right turn, then switch into the left lane"
10.0,s,Turn right and then continue going straight. Merge onto the left lane once the trucks clear up.
11.0,ds,Avoid the vehicle and obstructions in front of you by getting onto the middle of the road. Drive slowly and go back to the original lane once obstructions clear.
11.0,s,Drive around the road obstruction
11.0,s,Turn and split the lanes in order to avoid the trucks. Get back onto our side once the construction clears up.
11.0,s,turn left then go around the parked cars
12.0,d,Slow down when the  orange bus turns into your lane.
12.0,,Continue going straight.
13.0,,Continue going on the same lane
13.0,d,Follow yellow bus.
13.0,d,Follow the orange bus.
14.0,,Continue going on the same lane
14.0,d,continue straight when vehicle in front starts continuing straight
14.0,d,Follow the orange bus.
14.0,d,follow the orange bus
14.0,d,Follow yellow bus.
15.0,,Continue going on the same lane
15.0,d,Follow yellow bus.
15.0,d,Follow the orange bus.
16.0,s,Turn left and then continue going straight. Move on to the other lane when the FedEx truck is blocking our lane.
16.0,s,"Turn left, switch to the right lane when you see the stationary white truck"
16.0,s,"turn left , Drive around the road obstruction"
16.0,s,turn left and move around the parked vehicles
17.0,s,slide into the left turning lane and then stop at the zebra crossing
17.0,sd,Continue going straight and then change lanes to take a left. Wait for people to finish crossing
17.0,d,"switch lanes to the left lane, stop for incoming pedestrians"
17.0,d,Stop when the people are crossing the road
17.0,s,Switch to the left lane when it appears
18.0,,"Turn left, then turn left again when you can"
18.0,s,"make a left turn and drive aroudn road obstructions, turn left"
18.0,s,complete the left turn then enter the building horshoe
18.0,s,Merge on to the lane in front and then take the left turn.
19.0,sd,"turn left, make another left turn. "
19.0,sd,Take a left turn and then continue going straight. Watch out for people crossing. Start moving to the left.
19.0,,Turn left
19.0,d,Stop when you see the group of people at the stopwalk
19.0,,turn left
20.0,,Turn right into the road when traffic is clear
20.0,s,turn right at the intersection when it is safe
20.0,d,Wait for the black car to pass and then go straight and take a right. Then continue going straight.
20.0,d,Turn to the right once the car has passed through
21.0,s,turn right at the intersection when it is safe
21.0,d,Turn right once the car has passed through the intersection
21.0,d,Turn right into the road when traffic is clear
21.0,d,Wait for the cars to pass and the people to cross. Then move slowly and take a right turn.
22.0,s,Switch to the right lane when you see the stationary car ahead.
22.0,,Switch to the left lane
22.0,,"switch to the left lane, make a left turn. "
22.0,,Take the first left
22.0,s,Switch to the left lane and continue going straight. Then take a left turn.
22.0,s,slide into the left lane then turn left at the intersection
23.0,s,Quickly switch lanes to avoid the car in the road and then continue going straight in the same lane.
23.0,s,Drive around road blockages
23.0,s,Go to the left lane after you pass the car
24.0,ds,Come to a full stop before entering the intersection. Then merge onto the road if no cars are coming.
24.0,,"stop at the intersection, then continue going straight"
24.0,d,Continue going straight and merge onto the upcoming lane. Watch out for people crossing.
24.0,d,"stop for incoming traffic, if clear continue straight. "
25.0,d,Wait for the person and car to cross. Then take a right turn.
25.0,d,turn right after the pedestrian finishes crossing
25.0,d,"Wait for the person to cross the street and for the car to pass through the intersection, then turn right."
25.0,d,"stop for incoming traffic and pedestrians, once clear move straight. "
26.0,s,Quickly change lanes to avoid the car then get back to the left lane and continue going straight. Slow down behind the person in the motorcycle.
26.0,d,"Go on the right side of the car that is partially blocking the lane, then proceed back onto the left lane."
26.0,s,"Drive around the vehicles blocking the road, come to a complete stop behind stop vehicle. "
26.0,s,swerve around the parked cars
27.0,d,once vehicle begins to move turn to the right
27.0,s,Turn to the far right lane
27.0,d,"when the bike moves out of the way, turn right at the intersection"
27.0,d,Wait for the motorcycle person to pass and then take a right turn and go straight.
28.0,sd,Drive around the road obstruction.
28.0,s,"Switch partially to the right lane before reaching the car in front, and then stop at the stoplight."
28.0,s,Switch lanes and then go back to the orginal lane. Then wait at the stop lights. Wait for the people crossing.
28.0,s,swerve around the parked cars then stop at the intersection
29.0,,Just wait for the lights.
30.0,,Go straight on the lane. Then wait for a little bit before taking a left.
30.0,,Turn left slowly at the intersection
30.0,s,stop at the intersections
30.0,d,turn to the right once traffic is clear
31.0,,Follow the current lane.
32.0,,Take a left turn and merge onto the new road. Then continue on the new lane.
32.0,d,"turn left, turn left again. "
32.0,,turn left
32.0,,Take the very first left
33.0,d,Slow down when you are close to the large vehicle in front.
33.0,d,Continue going on the same lane. Slow down for the bust in front.
34.0,s,"Slightly go on the right lane, across the double marked lines, to avoid hitting the truck in front, then go back to the left lane."
34.0,s,Drive around the road obstruction
34.0,s,Continue on the same lane. Move to the next lane to avoid the truck and then get back onto the previous lane.
35.0,,Continue straight on the same lane.
36.0,,Continue on the same lane.
36.0,s,follow the road
37.0,s,"Go between the solid lines to avoid the vehicles on the left lane, then go back to the left lane once that is cleared."
38.0,sd,"follow the car ahead, avoid and drive around the vehicles on the side of the road"
38.0,s,Drive around the road blockages
38.0,s,"After passig the obstruction on the left side of the road, merge back onto the left lane"
38.0,d,Follow the gray car.
38.0,s,Split the lane to avoid the trucks on the side of the road.
39.0,,Continue straight
41.0,s,turn left at the intersection and merge onto the far right lane
41.0,s,"turn left, switch lanes all the way to right, stop behind the car"
41.0,s,"turn left at the intersection, then slide into the right most lane, then stop at the intersection"
41.0,s,Turn left onto the leftmost lane
41.0,s,Switch to the rightmost lane
41.0,s,Take a left turn and the continue going straight. Stop behind the white car.
42.0,s,Continue going straight and move slightly right to avoid the truck on your left.
42.0,s,Stay on the right side of the lane to avoid hitting the car on your left side of the lane
42.0,s,"go straight, move away slightly from parked vehicles "
42.0,s,Go back onto the left lane
42.0,s,Keep staying on the right side to avoid hitting the second car on the left side of your lane
43.0,s,stop at the intersection
43.0,s,Keep going straight and then stop at the stop light.
43.0,d,Slow down when you see when group of individuals crossing the street.
44.0,sd,slow down at the intersection and wait for the white truck to turn then continue
44.0,,Keep going straight and follow the same lane.
44.0,s,go straight
44.0,d,Slow down when the white truck turns left
45.0,d,Pass the toll gate when the gate opens
45.0,d,continue forward once gate opens
45.0,d,Stop at the toll gate once the car ahead passes through it
45.0,s,"stop at the barricade, once the arm is lifted proceed"
45.0,sd,Move slowly forward and stop behind the car in front of you. Stop in front of the crossing guard. Move once the crossing guard goes up.
46.0,s,stop at the intersection
47.0,s,continue straight at the intersection
48.0,sd,Slow down and watch the pedestrian and the turn right and continue going straight
48.0,s,"at the end of the construction turn right at the intersection, merge onto the left lane"
48.0,s,"turn right on the T-junction, then slide into the leftmost lane"
48.0,,Turn right at the intersection
48.0,d,Slow down when the person crosses the road
48.0,,"make a right turn, switch to the left lane"
49.0,s,Take the very first left and stay on the leftmost lane
49.0,,turn left
49.0,s,turn left at the intersection and continue straight 
49.0,s,turn left at the intersection
49.0,s,Keeping going straight then at the next turn take a left
50.0,,turn left
50.0,s,take the next left turn
50.0,,Take the very first left and go straight
50.0,s,turn right at the intersection
50.0,s,Keep going straight and then take the first left
51.0,s,Stop right before the intersection
51.0,sd,drive around the parked cars on the left and continue straight
51.0,s,"swerve around the parked cars then stop at the intersection, then move forward"
51.0,s,Switch lanes temporarily and then go back to the left lane and wait
51.0,s,"Drive around road blockages, come to a complete stop then continue straight. "
51.0,s,"Go on the right side of the parked cars, then go back to the lane once it's clear"
52.0,s,turn left  at the intersection
52.0,sd,"slow down as you approach the white car and continue along the road driving around any parked cars , take a left at the end of the road"
52.0,s,"Stay in the middle of the road to avoid the vehicle on the left and right side of the road, then go back on the left side."
52.0,sd,"slow down for incoming vehicle, avoid road obstruction, come to a complete stop then turn left. "
52.0,ds,Turn left at the intersection
52.0,d,Stay on the left side of the car approaching you
52.0,sd,Slow down and avoid the white car. Switch lanes to avoid the car in front and then take a left turn at the end of the street
53.0,d,follow the white sedan ahead of you in your lane
54.0,s,"turn left, avoid road obstruction"
54.0,,Make a left turn
54.0,sd,Take a left turn and aviad the cars and trucks  to the left. Split the lane until the trucks clear up.
54.0,s,turn right at the intersection
54.0,sd,turn left at the end of the intersection and drive around avoiding parked trucks on the road
54.0,s,"Stay in the middle of the lane to avoid the vehicles on the left and right sides of the road, but then proceed to switching to the left lanes ones the cars on the left clear."
55.0,d,follow the gray car ahead and turn right at the same intersection as it
56.0,d,Take the right turn that the grey vehicle in front of you takes.
56.0,,turn right
56.0,,Follow the road.
56.0,s,"turn left, then turn right at the intersection"
56.0,s,Continue going straight and then take the first right turn when available
57.0,,switch to the left lane
57.0,d,"Go straight, even once you see the individual crossing the crosswalk. Once passed the crosswalk, switch to the left lane."
57.0,s,"turn right, then slide into the left lane"
57.0,s,Take a right turn and then continue going straight.
58.0,s,Keep going straight and then switch to the left lane and take a left.
58.0,,turn left at the intersection 
58.0,s,Switch to the left lane once passing the parked vehicles that are on the left lane. Then take the first left
58.0,,"switch to the left lane, turn left"
58.0,s,slide into the left lane then turn left.
60.0,,wait for the prius to move forward
60.0,d,Start moving forward slowly when the vehicle in front of you starts to move.
61.0,,turn left follow the white van
61.0,s,Take the left turn and merge on to the road.
61.0,d,Follow the white van.
61.0,,turn left
61.0,s,slide into the left turing lane then turn left
61.0,d,Follow the vehicle in front of you.
61.0,,Switch to the left lane.
62.0,,side to the left lane
62.0,,switch to the left lane
62.0,,merge one lane over to the left
62.0,s,Keep going straight and then switch to the left lane
63.0,d,Follow the vehicle in front of you.
63.0,s,Stop right before the intersection.
63.0,,"slow down and stop, once road is clear continue straight. "
63.0,,stop at the intersection then proceed with caution
65.0,s,turn right at the intersection
65.0,,turn right
65.0,,take a right here and continue straight
65.0,,Make a right turn and go straight
65.0,s,Take the right turn and then keep going straight.
66.0,d,"Slowly move forward when there are no cars approaching from behind, but stop once cars are nearby."
66.0,d,check for incoming vehicles on left lane
66.0,d,wait until there are no vehicles approaching from behind 
67.0,d,Switch to the left lane once it is clear.
67.0,s,slide into the left lane
67.0,sd,Switch to the left lane and then keep going straight. Stop for the pedestrian. Then continue going straight.
67.0,d,"switch to left lane, stop for incoming pedestrian, once clear continue straight. "
67.0,d,"Stop right before the crosswalk to let the individual pass, then proceed as normal after."
67.0,sd,",merge onto the main road and stop at the cross walk and wait for pedestrian to cross"
68.0,,turn left
68.0,s,Keep going straight and then take a left.
68.0,d,Make a left turn once all cars from the left side have turned compeltely.
68.0,d,"sow down to avoid hitting the truck, then turn left"
68.0,,turn left at the intersection
69.0,,turn left
69.0,s,turn left at the intersection
69.0,,turn left here continue straight 
70.0,,turn left
70.0,,Make a left turn at the intersection
70.0,s,Keep going straight and then take a left.
70.0,s,turn left at the intersection
71.0,s,turn left at the intersection
71.0,s,"When you see the construction in front of you, take the first left."
71.0,s,Follow the road and then take a left to avoid the construction vehicle ahead.
71.0,,turn left
71.0,s,follow the road to the left and continue left at any obstructions
72.0,d,Make a right turn when the white vehicle passes you from the left.
72.0,s,Take a right turn and then continue.
72.0,s,stop at the intersection then turn right
72.0,d,turn right at the intersection when no vehicles are approaching 
72.0,d,wait for incoming traffic then turn right
73.0,s,stop at the stop sign  and turn right
73.0,,Turn right.
73.0,s,Go straight and then take a right turn.
73.0,,turn right
73.0,s,stop at the intersection then turn right
74.0,d,let the car in the front pass then turn left
74.0,d,Make a left turn when all vehicles from the left side pass by.
74.0,s,Take a left turn and merge onto the road and then continue going straight.
74.0,,turn left
74.0,,turn left when no vehicle are approaching  from either side of the road
76.0,,Make a right turn.
76.0,,take two immediate right turns
76.0,s,Take a right and then take another right.
76.0,s,"turn right, then turn right at the next intersection"
76.0,,"turn right, turn right"
76.0,,Make another right turn.
92.0,sd,continue straight and move away from obstacles and pedestrians 
93.0,,turn right and continue straight 
93.0,,Make a right turn into the middle lane and go straight
93.0,,turn right
93.0,s,turn right at the intersection
93.0,,Take a right turn and then continue going straight.
94.0,ds,Stop behind the vehicle in front of you.
94.0,s,stop at the intersection behind the car
94.0,,slow down
95.0,ds,Start moving forward when the vehicle in front of you starts to go forward.
95.0,d,"once vehicle in front moves, continue straight"
96.0,d,follow the white car ahead 
97.0,d,"once vehicle in front moves, continue straight"
97.0,d,start moving when the car in front starts moving
97.0,ds,Start moving forward when the vehicle in front of you starts to go forward.
97.0,d,follow the white car ahead 
99.0,,"Switch to the left lane once it is clear to switch, and then go striaght."
99.0,d,"once there is no vehicles in the left lane, switch to the left lane. "
99.0,sd,merge onto the left lane when no vehicles are approaching from behind
99.0,s,Switch to the left lane and then keep going straight.
99.0,d,slide into the left lane when there are no cars in the way
100.0,d,Wait until the car in front of you starts moving and make sure that the signal is green
100.0,s,Keep going straight and then switch to the right lane after the light.
101.0,d,follow the car ahead and go straight 
101.0,d,"Wait untill the signal turns green, let the car in front of you start moving, once you have started moving slide into the right lane while avoiding collision with the construction equipment on the side of the road"
101.0,s,Switch to the right lane once you pass all objstructions on the right side of the road.
101.0,s,Turn right and then continue going left.
101.0,d,"once vehicle in front moves, continue straight"
102.0,,turn right continue straight 
102.0,ds,"Make sure there is no one person on the zebra crossing in front of you, and make that the signal is green, then turn right make sure there's no one on the second zebra crossing, continue turing right until you have entered the lane"
102.0,d,"Keep going straight, but wait for the black van to merge on to the road."
102.0,,Make a right turn and go straight.
102.0,,turn right
103.0,d,Slow down when the car from the left hand side starts to turn onto the road.
103.0,s,"Keep going straight, slow down for the black van to merge"
103.0,d,slow down for incoming vehicle
103.0,d,"Pass through the yellow light, wait for the black SUV to join the lane, once it joins the lane continue driving"
104.0,ds,"make sure that the signal light in front of you is green, when the car in front of you starts moving you can start moving, continue driving in the same lane"
105.0,s,slide into the left-most lane and coninue driving in that lane
105.0,d,continue following the white car ahead
105.0,d,Keep a distance between the car in front of you.
106.0,d,"continue driving in the leftmost lane, when the car in front of you begins to slowdown, you slowdown as well"
107.0,d,Slow down a little to allow the bus to merge
107.0,,go straight
107.0,,continue straight
108.0,d,wait for the white car to pass when the road is clear turn right
108.0,,wait for incoming traffic then turn right
108.0,d,Make a right turn after the vehicle form the left side has passed.
108.0,sd,Wait for cars to pass and then turn right and keep going straight
108.0,d,turn right when no vehicles are approaching
109.0,s,Keep going straight around the roundabout
109.0,s,enter the roundabout and exit out the first turn
109.0,,Go about the roundabout and keep going straight
109.0,,Enter the round about and keep going straight
110.0,,go straight
120.0,d,"Stop right before the closed toll gate, then slowly go straight when it opens"
120.0,s,"continue going straight in the left most lane, wait for the gate to open, once open drive"
120.0,s,Keep going straight and slow down for the bump
120.0,d,"slow down at gate, once it opens continue straight"
121.0,,continue driving in the rightmost lane
121.0,s,continue straight stay on the right lane 
122.0,,"Stop at the intersection, turn right"
122.0,s,Keep going straight and wait for the other vehicles to pass before turning right
122.0,d,"stop for incoming traffic, turn right"
122.0,,Make a right turn.
122.0,,turn right when no vehicles are approaching
123.0,s,"Immediately after passing the parked truck on the left side of the road, switch to the left lane and make the turn."
123.0,s,Merge to left lane and continue on that lane
123.0,,switch to left lane
123.0,sd,merge into the left only lane after passing the parked truck and take the left turn 
123.0,s,"slide into the left-most lane and cexit from the main road, then continue to drive straight"
124.0,,go straight
125.0,,"switch to left lane, stop at intersection"
125.0,s,Stop at the next left turn
125.0,,"Before reaching the intersection, switch to the left lane."
125.0,ds,slide into the left lane and stop at the intersection to let the pedestrians pass.
125.0,,turn left at the end of the road
126.0,d,Take the same right turn as the vehicle in front.
126.0,d,"slow down, then turn right once near the broken line section in the middle of the road"
126.0,d,Take a left after the white vehicle has passed by.
126.0,,"turn left, turn right"
126.0,d,turn left once the the car in front of you has passed
126.0,s,Take a left turn and keep going straight and take the next right
126.0,sd,turn left when no vehicles are approaching and follow the white car ahead turn right 
127.0,sd,Wait for the bar to raise and the go slowly straight.
127.0,s,go straight drive around any parked vehicles or pedestrians
127.0,d,"slow down for oncoming pedestrians and traffic, continue straight once clear. "
127.0,ds,"Once the gate opens, slowly proceed and continue straight while avoiding the obstacles around."
127.0,s,"wait for the gate to open, then proceed slowly"
128.0,s,slow down at the zebra Crossing
129.0,,turn right
129.0,s,Take a right turn and keep going straight
129.0,s,"continue driving on the road, then stop at the zebra crossing and go straight."
130.0,d,"wait for the pedestrians to cross, then continue to go straight."
130.0,d,wait for pedestrians to cross the crosswalk and continue straight
130.0,d,Wait for the individuals to cross the street and then proceed forward.
130.0,d,"stop for pedestrians, once clear continue straight"
130.0,d,Wait for the pedestrians to pass before going straight
131.0,d,Make a left turn once the vehicle from the left passes by.
131.0,d,"stop for on coming traffic, once clear turn left. "
131.0,d,Wait for the white car to pass before turning left and merging onto the lane 
131.0,d,turn left when no vehicle is approaching 
131.0,d,"wait for the car to pass, then turn left"
132.0,s,"stop at the intersection, turn left"
132.0,s,turn left after the speedbump
132.0,s,Slow down before take a left turn
132.0,,turn left
132.0,ds,Take the left turn that is right after the speed bump and stay on the left side to allow the oncoming car to pass.
133.0,s,Slide back into the right lane to avoid colliding with the car in front
133.0,s,go around vehicle
133.0,s,"Go to the right side of the road to avoid hitting the bus on the left side of the road, and then switch back to the left once passed."
133.0,s,drive around the parked bus
133.0,s,Take a slight right to avoid the bus and then move back to the left lane.
133.0,s,"slide into the right lane to avoid colliding with the bus,"
134.0,,turn left here
134.0,s,Stop at the intersection stopsign. Then turn left
134.0,d,"stop for incoming traffic, once clear turn left. "
134.0,s,"stop at the intersection, then turn right"
134.0,sd,Wait for the white car to pass before turning left and merging onto the leftmost lane
135.0,,go straight
138.0,s,"stop at the crosswalk, then continue"
139.0,,conintue on the road
139.0,s,drive around pedestrians on the side of the road and merge into the left only lane at the intersection
149.0,,turn left
149.0,,turn left continue straight 
149.0,s,Take a left turn and then continue down the road
149.0,,turn right and continue on the road
149.0,,Turn left and continue.
150.0,,go straight
151.0,s,turn right at the intersection and stay in the right lane
151.0,s,"Before reaching the vehicle in front, switch to the right lane."
151.0,d,follow the gray car ahead and turn right
151.0,,turn right
151.0,s,Make a right turn and enter the first lane
151.0,s,Take right turn and continue down the road
