Scene Number,Instruction Type,Instruction
561.0,s,"when the signal turns green, turn left at the intersection"
561.0,,turn left here
561.0,d,Turn left when the stoplight turns green
562.0,s,Continue straight and slow down when approaching the stopped vehicle ahead
562.0,s,Slow down before approaching the white vehicle ahead
562.0,d,stop behind the stopped truck
563.0,sd,merge one lane to the right when there are no approaching vehicles 
563.0,,switch lanes to the right
563.0,d,swtich to the right lane when the truck is out of the way
563.0,d,Change one lane to the right
563.0,s,Switch to the right lane on the solid white line to avoid being in the turn lane.
564.0,,turn right
564.0,ds,Make a right turn turn following the truck directly ahead
564.0,ds,move when the truck starts moving and then turn right at the intersection
564.0,d,follow the truck ahead and turn right
565.0,d,turn right and then stop behind the truck
565.0,d,Follow the truck ahead. Stop at a safe distance behind the truck
565.0,d,Follow the yellow truck ahead of you
566.0,,Make a right turn at the intersection and go straight
566.0,s,Make a right turn and proceed straight
566.0,,trn right and go straight
566.0,,turn right
570.0,s,Make a right turn at the stop sign
570.0,,turn right
570.0,s,Make a full stop at the intersection then make a right.
570.0,s,turn right at the stop sign
574.0,s,turn left at the end of the road 
574.0,s,"turn left, then stop at the stop sign and then turn right."
574.0,,"turn left, turn right"
574.0,s,"Following the road, turn left and continue until the stop sign. At the stop sign turn right"
574.0,,Make a right turn
574.0,s,Stop at the stopsign and make a right turn
574.0,,Make a left turn and go srtaight
575.0,,turn right here and continue
575.0,,turn right
576.0,,turn right at the intersection
576.0,s,turn right at the intersection
576.0,s,Make a right turn at the light
576.0,,turn right
576.0,,Make a right turn at the intersection and go straight
577.0,,turn right at the intersection
577.0,,Make a right turn and go straight
577.0,s,Making a right turn. Continue straight 
577.0,,turn right here
578.0,d,Go straight when the stoplight turns green
578.0,d,Continue straight when the stop light turns green
578.0,,go straight
580.0,,turn left
580.0,s,turn left at the intersection
580.0,,Make a left turn
580.0,s,Make a left turn and continue straight
580.0,,turn left
582.0,,turn right
582.0,s,turn right at the intersection
582.0,s,turn right at the intersection
582.0,s,Make a right turn when you come about to the intersection and go straight
582.0,s,Make a right turn at the light
583.0,s,stop at the intersection then move ahead
584.0,d,turn right and then let the black car turn then continue
584.0,s,turn right at the stop sign
584.0,d,Slow down to allow the merging vehicle to get into the lane.
584.0,ds,Make a right turn. Slow down to allow the incoming vehicle to merge into the lane.
584.0,,turn right
586.0,,Go into the right lane to make a right turn
586.0,s,merge into the right turn only lane
586.0,,switch lanes to the right
586.0,s,enter the turning lane on the right
586.0,s,Change one lane to the right to be in the right turn lane
588.0,sd,turn right where there i are no approaching cars
588.0,,turn right at the intersection
588.0,,Make a right turn into the rightmost lane
588.0,,turn right
588.0,d,"When there are no incoming vehicles into turning lane, turn right and stay in the right most lane"
589.0,s,Make a right turn and continue straight
589.0,,turn right 
589.0,,Switch into the middle lane
589.0,,turn right
589.0,,turn right at the intersection
590.0,ds,Change lanes one to left to be in the middle lane. Continue straight when the light turns green and the bus passes the intersection
590.0,s,"slide into the left lane and stop at the intersection, move forward when the light turns green"
590.0,s,merge over one lane to the left
590.0,,switch to left lane
591.0,s,stop at the intersection
592.0,,Make a left turn
592.0,,turn left
592.0,,Make a left turn
592.0,,turn left at the intersection
592.0,,turn left here
593.0,,Make a right turn
593.0,,turn right
593.0,d,Make a right turn when all incoming vehicles have passed and all pedestrians have crossed the street
594.0,s,turn right at the intersection and then stop at the intersection behind the car
594.0,,turn right here
594.0,,turn right
596.0,ds,start moving when the car in front starts moving and then turn right at the intersection
596.0,ds,Turn left at the stop light when the light is a green arrow
596.0,,Make a left turn at the intersection
596.0,s,turn left at the intersection
596.0,,turn left
598.0,,turn right at the intersection
598.0,s,Make a right turn
598.0,,Make a right turn and go straight
598.0,,turn right here
599.0,,turn right
599.0,s,exit the roundabout on the first right
599.0,,turn right at the intersection
599.0,s,In the roundabout take the first exit
599.0,,Take a right at the roundabout
625.0,d,Follow the vehicle directly ahead
626.0,s,stop at the intersection
626.0,ds,Follow the vehicle directly ahead and enter the roundabout
629.0,,Continue straight
629.0,s,stop at the stopsign
629.0,,go on the right road and go straight
629.0,s,take a slight right and continue on the road
629.0,s,stop at   the intersection then go straight
630.0,s,Continue straight once at the stop sign
630.0,s,stop at the stopsign
630.0,s,stop at   the intersection then go straight
632.0,,"turn right, turn right"
632.0,s,"Following the road, turn right at the corner. Shortly after turning the corner, turn right"
632.0,,Make a right turn
632.0,,Make another right turn
632.0,s,take a right the end of the road and another right at the intersection
632.0,s,turn right and then turn right again at the next intersection
634.0,,Make a left turn
634.0,,turn left
634.0,,turn left here
634.0,s,Make a left turn
634.0,s,turn left at the intersection
634.0,s,Stop at the stopsign
634.0,d,Slow down before approaching the vehicle ahead of you
635.0,d,Stop and wait for the semi-truck to park
635.0,d,Wait until the vehicle in front of you is not blocking the lane to proceed forward.
636.0,,Make a right turn
636.0,,Stop at the stopsign.
636.0,s,take a right at the stop sign
636.0,s,turn right at the intersection
636.0,s,Make a right at the stop sign
636.0,,turn right
638.0,,Make a left turn at the itnersection
638.0,,turn left
638.0,sd,turn left at the intersection when there are no incoming vehicles
638.0,d,Wait until oncoming traffic passes and make a left turn
638.0,,turn left
639.0,s,stop at the intersection
640.0,s,Continue straight and stay in the middle lane
640.0,,Go straight when the stoplight turns green
641.0,s,slide into the right lane and stop at the intersection
641.0,,"After crossing the intersection, switch into the right lane."
641.0,s,"Passing the light, change one lane to the right"
641.0,s,merge one lane over to the right after the intersection 
642.0,,Go straight when the stoplight turns green
642.0,d,Continue straight when the light turns green
642.0,s,start moving when light turns green
645.0,s,merge over one lane to the right and turn right at the intersection
645.0,s,"slide into the right lane, stop at the intersection then turn right"
645.0,,turn right
645.0,d,Make a full stop at the blinking light. Turn right when the pedestrian isn't an obstacle in the turning lane
645.0,,Make a right turn
645.0,d,Switch to the right lane and come to a full stop at the flashing stoplights
646.0,,turn right here
648.0,,slide into the right lane
648.0,s,Switch into the right lane after passing by the white large vehicle thats on the right side of the road
648.0,s,Continue straight and change to the right most lane
649.0,s,merge one lane over to the right and turn turn right at the intersection
649.0,,turn right
649.0,s,stop at the intersection
650.0,s,stop at the red light
651.0,d,Make a left turn at the intersection once all cars from the left side of the road have cleared
651.0,d,Go straight on the greenlight
651.0,d,"let the oncoming traffic pass, then turn right"
651.0,d,turn left here when there are no approaching vehicles 
651.0,d,Turn left when the oncoming traffic has passed
653.0,ds,Allow the pedestrians to cross the road and continue straight when the pedestrian aren't an obstacle on current lane
653.0,d,stop for the pedestrians
653.0,d,Come to a stop before approaching the pedestrians to allow them to cross the road.
653.0,d,"stop and let the pedestrians cross, then continue"
654.0,s,Stop at the stopsign
654.0,s,turn right and stop at the stop sign then continue
657.0,sd,turn left at the intersection when there are no approaching vehicles from the other side of the road
657.0,ds,Make a left turn when there's no oncoming traffic
657.0,,turn left
657.0,s,Make a left turn at the intersection
657.0,s,stop at the intersection then turn left
658.0,,turn left
658.0,d,Make a left turn when it is safe to do so
658.0,s,stop at the intersection then turn left
658.0,sd,turn left at the intersection when there are no approaching vehicles from the other side of the road
658.0,s,Make a left turn 
660.0,s,"continue striaght ahead, avoid hitting the parked vehicles"
660.0,s,Continue straight taking a slight left around the parked semi-truck
660.0,,go left
660.0,,follow the road to the left and continue straight
661.0,s,turn left at the end of the road
661.0,s,Make a left turn at the end of the road
661.0,s,Make a left turn at the end of the road
661.0,s,turn left at the barricades
661.0,,turn left
662.0,s,stop at the stop sign
662.0,,Stop at the stopsign
663.0,s,turn left at the intersection
663.0,,Make a left turn and countinue straight
663.0,s,Make a left turn at the stop sign
663.0,,turn left
663.0,,turn left here
664.0,,follow the road
665.0,d,Make another left turn when the vehicle from the left side crosses the intersection
665.0,,turn left to exit the parking lot and take a left onto the main road
665.0,,turn left
665.0,,Make a left turn
665.0,d,turn left stop at the intersection and move forward only when all cars have passed
665.0,ds,Make a left turn and then take another left onto the main street if there's no oncoming traffic
666.0,d,"Slow down to let the pedestrian cross. When the pedestrian isn't an obstacle on the road, continue straight"
666.0,d,Slow down to allow the pedestrian in front of to complete walking across the road.
667.0,d,drive around the parked truck and continue straight 
667.0,s,Briefly go onto the left side of the road to avoid the parked vehicle in your lane
667.0,ds,"Continuing straight, go around the unloading truck in the street briefly going in the opposite lane"
667.0,s,swerve around the parked truck
667.0,s,go around the vehicle
669.0,,turn right here
669.0,,Turn right at the light
669.0,,Make a right turn into the middle lane
669.0,,turn right
669.0,s,turn right then go straight
671.0,,stop at the intersection
673.0,s,stop at the red light
674.0,d,slow down for the pedestrian
675.0,d,Slow down for the pedestrian in front of you
675.0,d,proceed slowly to avoid hitting the wheelchair
675.0,d,Slowly proceed with caution maintaining a safe distance between the moving pedestrian
676.0,d,"Continue proceeding with caution, come to a stop before the flashing pedestrian sign and proceed when safe to do so"
676.0,d,poceed slowly to avoid the wheelchair
677.0,d,proceed slowly to avoid hitting the wheelchair
678.0,d,poceed slowly to avoid the wheelchair
679.0,d,"When the pedestrian in the wheel chair goes out to the side, cautiously go around him and continue straight"
679.0,d,"Once it is safe to do so, pass the pedestrian on the wheelchair"
680.0,,turn left here and drive around the parked trucks 
683.0,d,Follow the vehicle directly ahead
683.0,,Merge into the right lane when it opens
685.0,,turn right at the intersection
685.0,ds,Make a right turn when the pedestrian isn't an obstacle in the lane you're turning into
685.0,,turn right
685.0,,Make a right turn at the intersection
687.0,d,turn right when there are no pedestrians 
689.0,d,"When the light turns green, continue straight and follow the vehicle ahead"
689.0,d,Coninue straight wehen the stoplight turns green
695.0,d,"Continue straight, slow down to let the car turn to avoid an accident"
696.0,d,Slow and come to a stop if needed to allow the pedestrian to cross
696.0,d,stop and wait for the pedestrians
696.0,d,Stop before the stopwalk to allow the pedestrian to cross the road
697.0,d,"After the pedestrian crosses the road, continue straight"
697.0,d,"Once pedestrian crosses and isn't an obstacle in the path, continue straight"
700.0,s,Make a right turn at the intersection into the middle lane
700.0,,turn right
700.0,s,Make a right turn at the light
700.0,,turn right here
703.0,d,Continue straight when the stoplight turns green
709.0,d,Go on the left side of your lane before appraoching the construction that is on the right side of your lane
710.0,d,Come to a stop for the pedestrians acrossing the street ahead of you
710.0,d,stop for the pedestrians
711.0,,merge onto the left lane
711.0,,switch lanes to the right
711.0,,Switch to the right lane
711.0,s,Change one lane to the right
711.0,d,Switch back to the lane lane to avoid the construction ahead of you when no cars are coming from behind
712.0,,"After crossing the intersection, switch to the rightmost lane"
712.0,s,"When on the bridge, change one lane to the right"
716.0,ds,Make a right turn at the light
716.0,,turn right
716.0,,turn right at the signal
716.0,d,Make a right turn at the intersectin when the light turns green and there are no pedestrians on the road
719.0,,turn right
719.0,s,Make a right turn at the light
719.0,ds,Make a right turn at the intersection when the stpolight turns green
728.0,d,Continue straight when the stoplight turns green
734.0,d,Proceed straight when the stoplight turns green
736.0,s,Stop at the stopsign and then make a left turn
736.0,s,Make a left turn at the stop sign
736.0,,turn left
737.0,,turn right
737.0,s,Make a right turn 
738.0,s,Take the second exit in the roundabout
739.0,s,Stop at the stopsign
740.0,,turn right
740.0,s,Make a right turn at the intersection
740.0,,Make a right turn
744.0,s,Stop at the stopsign
746.0,,go all the way to the left lane
746.0,s,Shift to the lane on the left
746.0,,Switch into the leftmost lane
750.0,d,Move the car to the right to allow the oncoming vehicle to pass
750.0,d,Proceed straight when the stpolight turns green
750.0,d,Move the vehicle to the right to allow the truck to properly turn
752.0,s,Go around the vehicle stopped in the road briefly going in the opposite lane
752.0,s,go around the road obstruction
752.0,s,Avoid the parked vehicle ahead of you by going around it on the left side and then proceed back into the same lane
760.0,,turn right
760.0,,Make a right tturn at the greenlight and when it is safe to do so.
760.0,d,Make a right turn at the light when it turns green. Slow down for a small amount of time to allow the oncoming vehicle to turn into the road first
760.0,s,"Go onto the left side of the road, if it is clear, to avoid the parked vehicle in front. Then go back onto the right side of the road."
762.0,s,Make a right turn at the first set of lights
762.0,s,Make a right turn at the intersection
762.0,,turn right
764.0,d,Keep a safe distance between the individual on the bicycle in front of you
768.0,s,"Slightly go onto the left lane, if it is safe, to avoid the parked vehicle on the right side of your lane."
768.0,ds,Go around the stopped vehicle on the road by going in the left lane only if it's safe to do so
769.0,,Make a right turn at the intersection
769.0,ds,Make a right turn at the light. Go around the stopped vehicle by going in the opposite lane only if it's safe to do so
769.0,s,"turn right, go around the vehicle"
770.0,,stop at the curb
778.0,s,Make a U turn
778.0,,Make a u-turn
778.0,,take a u-turn
783.0,s,Past the second set of lights change one lane to the right
783.0,s,"Before coming to a stop at the intersection, turn to the lane with the forward marking"
783.0,,switch to the right lane
790.0,d,Continue straight whent the stoplight turns green
798.0,d,Follow the grey vehicle in front of you
799.0,d,Keep following the grey vehicle in front of you
800.0,d,Keep following the grey vehicle in front of you
802.0,d,Keep following the grey vehicle in front of you
803.0,,"When it is clear to do so, merge onto the road from the parking space."
803.0,,merge onto the road when there are no oncoming cars
808.0,d,Continue straight when the stoplight turns green
812.0,,switch lanes to the right
812.0,,merge into right rurn only lane
812.0,d,Continue straight when the stoplight turns green
815.0,s,turn right at the signal and merge into the left most lane
815.0,,"turn right, switch lanes to the right"
815.0,,Make a right turn
816.0,,take the third roundabout exit
816.0,s,Go around the round about and make the left turn
816.0,,turn left at the roundabout
817.0,s,Stop at the stopsign
819.0,,turn right
819.0,s,Make a right turn at the intersection
819.0,s,as the stop sign turn right
821.0,,After crossing the first intersection stay on the left side of the road
821.0,,follow the road
848.0,s,Switch to the right lane to avoid the parked cars on your lane
848.0,d,Slow down to allow the pedestrian to cross the road
848.0,,switch to the right lane
849.0,,switch to the left lane
850.0,,continue going along the road
852.0,,merge into the far left lane
852.0,s,"switch to the right lane in order to avoid hitting the parked cars, then near the turning lanes switch back to the left lane"
852.0,s,Change to the right lane and go back to the left lane when there are no obstructing cars
852.0,s,Go into the left turn lane
852.0,,switch to the right lane
853.0,s,Go into the middle lane
853.0,d,"slow down to avoid hitting the car(white SUV), then carefully follow that car and stop behind it."
853.0,,turn left
853.0,,take a right into the connecting road
853.0,,turn left here
854.0,d,follow the white SUV in front while maintaining a safe distance
855.0,,turn right
855.0,d,turn right and proceed slowly in order to avoid hitting the turning cars
855.0,d,Allow the vehicle with the left lane blinker to merge into your lane
855.0,,Make a right turn
856.0,,continue on this road
861.0,d,Make a right turn when there are no cars coming from the left side
861.0,d,"wait for all the vehicles to pass, then carefully turn right "
861.0,,turn right
861.0,,turn right at the intersection
862.0,ds,Stop before the crosswalk to allow the pedestrian to walk accross the road. Then continue once it is clear
862.0,,stay on the far left lane and keep keft at the fork
862.0,d,"stop at the crosswalk, let the pedestrians cross, then continue moving ahead"
863.0,,Make a right turn
863.0,,turn right
863.0,s,turn right at the intersection and stay in the left lane
865.0,,Make a right turn
865.0,,turn right into the connecting road
865.0,s,"Go slightly on the right side of the road to avoid the parked vehicle in front, then go back onto the lane."
865.0,s,"turn right, go around road obstruction"
865.0,s,"turn right at the intersection, then swerve around the parked tempo"
866.0,,turn right 
866.0,,keep right
866.0,s,turn right at the fork
868.0,,Make a right turn
868.0,,complete the right turn
868.0,,turn right and continue
872.0,d,When the light turns green continue straight
872.0,s,move ahead when the signal turns green
876.0,d,When the light turns green continue straight
876.0,s,when the signal turns green go straight
878.0,s,stop at the signal
880.0,s,turn left at the traffic signa
880.0,ds,"Continue straight when the stoplight turns green, and after passing it, make a left turn"
880.0,s,"when the signal turns green, turn right at the intersection"
882.0,,turn left
882.0,s,"turn right, when the signal turns green"
882.0,ds,When the stoplight turns green make a left turn
882.0,s,turn left at the signal
883.0,s,stop at the signal
885.0,s,go stright when the signal turns green
885.0,d,Continue straight when the stpolight turns green
886.0,s,stop before the crosswalk when the signal turns red
888.0,,Make a right turn
888.0,s,"when the signal turns green, turn right"
888.0,,turn right
889.0,s,stop at the signal
890.0,d,wait for the oncoming traffic to pass ten turn left
890.0,ds,"When the stoplight turns green, make a left turn at the intersection once all cars have passed by"
891.0,,turn left here
891.0,s,complete the left turn and go stright
891.0,,turn left
894.0,ds,Make a left turn once all of the pedestrians have crossed the crosswalk
894.0,s,turn left at the intersection
894.0,,turn left into the intersection
894.0,,turn left
896.0,s,"swerve around the parked trailer, then re-join the right lane"
896.0,s,go around the vehicle obstructing the road
897.0,ds,"stop at the stop sign, behind the jeep, wait for the pedestrian to cross, then go straight"
898.0,s,stop at the signal
899.0,s,go straight when the signal turns green
899.0,d,When the stoplight turns green go straight
900.0,,turn left at the interesction
900.0,d,"When the stoplight turns greeen, make a left turn if there are no oncoming cars"
900.0,d,"turn right at the intersection, avoid hitting the oncoming traffic"
902.0,s,stop behind the bus at the intersection
905.0,s,slide into the right lane
906.0,s,Make a right turn at the intersection
906.0,s,turn right at the intersection
906.0,,turn right
907.0,s,at the signal turn right
907.0,s,complete the right turn and then stop behind the stopped vehicle
908.0,d,"when the vehicle in front starts moving, drivbe forward"
914.0,s,slide into the right turning lane near the intersection
914.0,s,"Before stopping at the intersection, switch to the right lane"
914.0,,switch lanes to the right
915.0,,turn left here and continue 
915.0,,turn right lef at the intersection
915.0,,Make a left turn
915.0,,turn left
916.0,,"turn right, turn right"
916.0,s,Follow the road through the parking lot
916.0,s,"complete the right turn, then follow the road to exit the parkig lot"
917.0,,Make a left turn at the intersection
917.0,ds,"slow down for the pedestrians, breifly stop at the intersection, then turn right"
917.0,,turn left
917.0,,at the intersection turn left
917.0,ds,Slow down to allow the pedestrians to cross the road
920.0,,turn right
920.0,,turn right
920.0,,Make a right turn
921.0,s,stop at the intersection then turn left
921.0,ds,Stop at the stopsign and make a left turn once all cars from the right side have passed
921.0,s,at the stop sign turn left
921.0,,turn left
922.0,s,"Briefly go on the right side of the road to avoid the parked vehicle in front, then go back to the original lane"
922.0,s,go around the bus
922.0,s,swerve around the parked vehicle
925.0,d,"stop at the crosswalk and let the pedestrians cross, then move ahead"
925.0,ds,Stop before the crosswalk to allow pedestrians to cross the road and proceed after they have crossed
926.0,,turn right at the intersection
926.0,s,Make a right turn and go down the road
926.0,,turn right
928.0,,turn right
928.0,,Make a right turn at the intersection
928.0,s,turn right at the intersection
929.0,d,Stop before the toll gate and proceed when the toll gate opens
929.0,s,"stop at the gate, once the arm is lifted proceed"
930.0,s,turn right at the fork
930.0,,turn right
931.0,s,enter the horseshoe and stop at the gate
931.0,s,Take a left and stop at the front of the entrance
931.0,,go to the left and stop in front of the building
945.0,,"turn left, turn left"
945.0,,Make the first left turn possible
945.0,s,Make a left turn while avoiding the construction.
945.0,s,"turn right at the intersection avoid hitting the traffic cones, reverse back slighly and merge into the left lane"
947.0,,turn left at the intersection
947.0,,turn left
949.0,s,stop at the intersection
952.0,s,"stop at the intersection, then proceed"
952.0,s,Merge to the left lane and stop before entering the main road.
952.0,,Slowly enter the main road after the foll stop
953.0,,Switch to the left lane
955.0,s,Switch to the right lane briefly to pass the parked vehicle ahead and go back to the left lane immediately after
958.0,s,Come to a stop when you appraoch the parked vehicle in front
958.0,d,"When the light turns green, proceed straight"
959.0,d,"Switch to the right lane when there are no cars coming from behind, then switch back to the left lane once you have passed all obstructions"
959.0,,go around the vehicle obstructing the road
960.0,,turn left
960.0,d,Make a left turn if there are no cars coming from the right side
961.0,s,Switch to the right lane when you see the parked vehicle ahead.
962.0,,"At the intersection, make a left turn onto the leftmost lane"
962.0,,turn left
963.0,,Switch to the rightmost lane
966.0,,go around the vehicle obstructing the road
966.0,s,Slowly pass the parked vehicle on your lane by staying on the right side.
967.0,s,Stop at the sotpsign
967.0,d,Slowly pass the pedestrians that are a little bit on the row
968.0,s,Stop before the closed toll gate
968.0,,turn right
968.0,d,"Once all cars from oncoming traffic have passed, make a right turn"
969.0,s,Go around the parked vehicle in your lane by going around on the right
969.0,,go around the vehicle obstructing the road
969.0,d,"When the toll gate opens, continue straight"
971.0,,Make a right turn
971.0,,turn right
979.0,d,Continue straight once the stoplight turns green
980.0,,Make a left turn before approaching the construction in your lane
983.0,d,After passing the intersection switch to the right lane
988.0,,at the end of the road turn right
988.0,,Make a right turn if there are no cars coming from the left side
989.0,ds,"Come to a stop before the crosswalk to allow the pedestrian to cross the road. After the pedestrian has crossed the road, continue forward"
990.0,,continue on this road
991.0,d,Stop at a safe distance behind the unloading vehicle
991.0,sd,stop right behind the gray car and wait for the people to pass
991.0,ds,Come to a stop when you see pedestrians in front of you
994.0,s,take the roundabout
